{
  "$schema": "https://json-schema.org/draft/2020-12/schema",
  "$id": "https://github.com/1-hive/hive-record/schemas/profile-v1.schema.json",
  "title": "hive.profile/1 (SPEC \u00a713)",
  "type": "object",
  "additionalProperties": false,
  "required": [
    "schema",
    "name",
    "version",
    "extends",
    "add_classes",
    "add_rels",
    "add_codes",
    "entities",
    "rules",
    "amend",
    "inbox"
  ],
  "properties": {
    "schema": {
      "const": "hive.profile/1"
    },
    "name": {
      "type": "string",
      "pattern": "^[a-z0-9][a-z0-9._-]{0,63}$",
      "maxLength": 64
    },
    "version": {
      "type": "string"
    },
    "extends": {
      "const": "core@1"
    },
    "add_classes": {
      "type": "array",
      "items": {
        "type": "string",
        "pattern": "^[a-z0-9][a-z0-9._-]{0,63}$",
        "maxLength": 64
      }
    },
    "add_rels": {
      "type": "array",
      "items": {
        "type": "string",
        "pattern": "^[a-z][a-z0-9_]*$",
        "maxLength": 64
      }
    },
    "add_codes": {
      "type": "array",
      "items": {
        "type": "string",
        "pattern": "^[A-Z][A-Z0-9_]*$",
        "maxLength": 64
      }
    },
    "entities": {
      "type": "object",
      "additionalProperties": {
        "type": "object",
        "additionalProperties": false,
        "required": [
          "collection",
          "id",
          "state_field",
          "states",
          "terminal",
          "unknown_code",
          "exists_code",
          "illegal_code",
          "mirrorable"
        ],
        "properties": {
          "collection": {
            "type": [
              "string",
              "null"
            ]
          },
          "id": {
            "type": [
              "string",
              "null"
            ],
            "pattern": "^(task|goal|data\\.[a-z_]+)$"
          },
          "state_field": {
            "type": "string"
          },
          "states": {
            "type": "array",
            "items": {
              "type": "string",
              "pattern": "^[a-z0-9][a-z0-9._-]{0,63}$",
              "maxLength": 64
            }
          },
          "terminal": {
            "type": "array",
            "items": {
              "type": "string",
              "pattern": "^[a-z0-9][a-z0-9._-]{0,63}$",
              "maxLength": 64
            }
          },
          "unknown_code": {
            "type": "string",
            "pattern": "^[A-Z][A-Z0-9_]*$",
            "maxLength": 64
          },
          "exists_code": {
            "type": "string",
            "pattern": "^[A-Z][A-Z0-9_]*$",
            "maxLength": 64
          },
          "illegal_code": {
            "type": "string",
            "pattern": "^[A-Z][A-Z0-9_]*$",
            "maxLength": 64
          },
          "mirrorable": {
            "type": "boolean"
          }
        }
      }
    },
    "rules": {
      "type": "array",
      "items": {
        "type": "object",
        "additionalProperties": false,
        "required": [
          "event",
          "entity",
          "classes",
          "relation",
          "from",
          "to",
          "refs",
          "conditions",
          "effects"
        ],
        "properties": {
          "event": {
            "type": "string",
            "pattern": "^[a-z][a-z0-9_]*(\\.[a-z][a-z0-9_]*)+$",
            "maxLength": 64
          },
          "entity": {
            "type": "string",
            "pattern": "^[a-z0-9][a-z0-9._-]{0,63}$",
            "maxLength": 64
          },
          "classes": {
            "oneOf": [
              {
                "const": "*"
              },
              {
                "type": "array",
                "minItems": 1,
                "items": {
                  "type": "string",
                  "pattern": "^[a-z0-9][a-z0-9._-]{0,63}$",
                  "maxLength": 64
                }
              }
            ]
          },
          "relation": {
            "enum": [
              null,
              "owner",
              "self",
              "proposer",
              "requester"
            ]
          },
          "from": {
            "oneOf": [
              {
                "type": "null"
              },
              {
                "enum": [
                  "*",
                  "open"
                ]
              },
              {
                "type": "array",
                "minItems": 1,
                "items": {
                  "type": "string",
                  "pattern": "^[a-z0-9][a-z0-9._-]{0,63}$",
                  "maxLength": 64
                }
              }
            ]
          },
          "to": {
            "oneOf": [
              {
                "type": "string"
              },
              {
                "type": "object",
                "additionalProperties": false,
                "required": [
                  "by",
                  "map"
                ],
                "properties": {
                  "by": {
                    "type": "string"
                  },
                  "map": {
                    "type": "object",
                    "additionalProperties": {
                      "type": "string",
                      "pattern": "^[a-z0-9][a-z0-9._-]{0,63}$",
                      "maxLength": 64
                    }
                  }
                }
              }
            ]
          },
          "refs": {
            "type": "object",
            "additionalProperties": false,
            "required": [
              "required",
              "allowed"
            ],
            "properties": {
              "required": {
                "type": "array",
                "items": {
                  "type": "string",
                  "pattern": "^[a-z][a-z0-9_]*$",
                  "maxLength": 64
                }
              },
              "allowed": {
                "type": "array",
                "items": {
                  "type": "string",
                  "pattern": "^[a-z][a-z0-9_]*$",
                  "maxLength": 64
                }
              }
            }
          },
          "conditions": {
            "type": "array",
            "items": {
              "oneOf": [
                {
                  "type": "string"
                },
                {
                  "type": "object",
                  "additionalProperties": false,
                  "required": [
                    "name"
                  ],
                  "properties": {
                    "name": {
                      "type": "string"
                    },
                    "args": {
                      "type": "array",
                      "items": {
                        "type": "string"
                      }
                    }
                  }
                }
              ]
            }
          },
          "effects": {
            "type": "array",
            "items": {
              "type": "string"
            }
          },
          "exceptable": {
            "type": "boolean"
          }
        }
      }
    },
    "amend": {
      "type": "object",
      "additionalProperties": {
        "type": "object",
        "additionalProperties": false,
        "properties": {
          "add_classes": {
            "type": "array",
            "items": {
              "type": "string",
              "pattern": "^[a-z0-9][a-z0-9._-]{0,63}$",
              "maxLength": 64
            }
          },
          "add_conditions": {
            "type": "array",
            "items": {
              "oneOf": [
                {
                  "type": "string"
                },
                {
                  "type": "object",
                  "additionalProperties": false,
                  "required": [
                    "name"
                  ],
                  "properties": {
                    "name": {
                      "type": "string"
                    },
                    "args": {
                      "type": "array",
                      "items": {
                        "type": "string"
                      }
                    }
                  }
                }
              ]
            }
          },
          "add_effects": {
            "type": "array",
            "items": {
              "type": "string"
            }
          },
          "add_refs": {
            "type": "object",
            "additionalProperties": false,
            "required": [
              "required",
              "allowed"
            ],
            "properties": {
              "required": {
                "type": "array",
                "items": {
                  "type": "string",
                  "pattern": "^[a-z][a-z0-9_]*$",
                  "maxLength": 64
                }
              },
              "allowed": {
                "type": "array",
                "items": {
                  "type": "string",
                  "pattern": "^[a-z][a-z0-9_]*$",
                  "maxLength": 64
                }
              }
            }
          },
          "require_ext": {
            "type": "array",
            "items": {
              "type": "string"
            }
          },
          "require_goal": {
            "type": "boolean"
          },
          "forbid_exceptions": {
            "type": "boolean"
          }
        }
      }
    },
    "inbox": {
      "type": "object",
      "additionalProperties": {
        "type": "array",
        "items": {
          "type": "string"
        }
      }
    },
    "hooks": {
      "type": "object",
      "additionalProperties": false,
      "properties": {
        "on_touch": {
          "type": "array",
          "items": {
            "type": "string"
          }
        },
        "on_terminal": {
          "type": "array",
          "items": {
            "type": "string"
          }
        }
      }
    },
    "waivable_codes": {
      "type": "array",
      "items": {
        "type": "string",
        "pattern": "^[A-Z][A-Z0-9_]*$",
        "maxLength": 64
      }
    },
    "repeatable_rels": {
      "type": "array",
      "uniqueItems": true,
      "items": {
        "type": "string",
        "pattern": "^[a-z][a-z0-9_]*$",
        "maxLength": 64
      },
      "description": "Rels of this profile that a request may carry more than once (amendment A3). Core rels stay unique."
    },
    "ancestry": {
      "type": "array",
      "items": {
        "type": "object",
        "additionalProperties": false,
        "required": [
          "ancestor",
          "descendant",
          "code"
        ],
        "properties": {
          "ancestor": {
            "type": "string",
            "pattern": "^[a-z][a-z0-9_]*$",
            "maxLength": 64
          },
          "descendant": {
            "type": "string",
            "pattern": "^[a-z][a-z0-9_]*$",
            "maxLength": 64
          },
          "code": {
            "type": "string",
            "pattern": "^[A-Z][A-Z0-9_]*$",
            "maxLength": 64
          }
        }
      },
      "description": "Admission-only checks (amendment A3): each `descendant` pin's commit must have the `ancestor` pin of the same repository as an ancestor, else the request is refused with `code`. Checked at pin verification (\u00a712.1 step 7), so not replayed by the fold."
    }
  }
}
